人工智能+python课程研究员(J11689),北京传智播客教育科技有限公司,北京-昌平区,4-6万/月,01-09
Python高级开发工程师,北京方圆众创网络科技有限公司,深圳-南山区,1-3万/月,01-09
Python后端工程师,深圳市铱�}医疗科技有限公司,深圳-南山区,1-1.8万/月,01-09
Python开发工程师（渲染）,深圳市瑞云科技有限公司,深圳-南山区,7-9千/月,01-09
Python后台,恒拓开源信息科技股份有限公司广州分公司,广州-天河区,0.9-1.4万/月,01-09
Python开发工程师,武汉江辉晟兴网络科技有限公司,武汉-洪山区,0.8-1万/月,01-09
python开发工程师,浙江元一家居用品集团有限公司,杭州-萧山区,1-1.5万/月,01-09
Python开发工程师,临沂影漫文化传媒有限公司,异地招聘,6-8千/月,01-09
全栈工程师（Python）,诺亚歌斐投资管理,上海-杨浦区,1.5-2.5万/月,01-09
Python开发工程师,源讯信息技术（中国）有限公司,大连-高新园区,6-8千/月,01-09
C++/Python/QT软件工程师,思力科（深圳）电子科技有限公司,深圳-南山区,1.2-2.5万/月,01-09
python编程教师  (全职/***  授课方向),北京爱提分博乐教育科技有限公司,北京-海淀区,1.5-2.5万/月,01-09
Python开发工程师-ZH,北京四维图新科技股份有限公司,北京,2-4万/月,01-09
底薪5K少儿编程教师Java/python,湖南好小子机器人科技有限公司,长沙-芙蓉区,6-8千/月,01-09
Python Web开发工程师,深圳市风云实业有限公司,成都-青羊区,7-9千/月,01-09
Python开发工程师,成都壹玖捌玖科技有限公司,成都-金牛区,6-8千/月,01-09
Python 开发工作,上海领旗信息科技有限公司,上海-浦东新区,1-1.5万/月,01-09
Python运维开发工程师,上海驿氪信息科技有限公司,上海-闵行区,15-25万/年,01-09
Python研发工程师（房山良乡，苏庄地铁站附近）,北京凤凰学易科技有限公司,北京-房山区,2-4万/月,01-09
资深Python工程师,火石创造（医健产业大数据）,杭州-滨江区,1.5-2.5万/月,01-09
高薪诚聘python 开发工程师,武汉飞猫环球商贸有限公司,武汉-洪山区,0.8-1万/月,01-09
JAVA/ Python讲师(上市外企+双休+五险一金）,童程童美济南分公司,济南-市中区,6-8千/月,01-09
高级资深python开发工程师,上海速石信息科技有限公司,上海-杨浦区,2.5-5万/月,01-09
python开发工程师,上海杰奕信息技术有限公司,上海-虹口区,0.8-2万/月,01-09
Python开发,成都汇智动力职业技能培训学校,成都-武侯区,6-8千/月,01-09
Python开发工程师,浩鲸云计算科技股份有限公司,广州-番禺区,1.2-1.8万/月,01-09
Python工程师,静瞳海外投资顾问（深圳）有限公司,广州,1-2万/月,01-09
Python全栈工程师,深圳市力川华弘实业有限公司,深圳-南山区,1.8-3万/月,01-09
python 开发工程师,上海网达软件股份有限公司,上海-虹口区,1.3-2.5万/月,01-09
Python开发工程师,上海置天信息技术有限公司,上海,1-1.5万/月,01-09
Python工程师,深圳市公狼网络科技有限公司,深圳,1-1.5万/月,01-09
Python开发工程师（odoo）,深圳市有芯电子有限公司,深圳,1.5-2.5万/月,01-09
python工程师,深圳市爱飞亿科技有限公司,深圳-龙岗区,1-1.5万/月,01-09
Python高级开发工程师,北京棣南新宇科技有限公司,北京-海淀区,1.5-2万/月,01-09
Python高级开发工程师,深圳市云盾科技有限公司,深圳-龙华新区,1-1.5万/月,01-09
Python高级研发工程师,北京从零到壹科技有限公司,北京-昌平区,1-2万/月,01-09
python讲师,湖南潭州教育网络科技有限公司,长沙-岳麓区,0.6-1.2万/月,01-09
Python开发工程师,广州西麦科技股份有限公司,广州,0.9-1.5万/月,01-09
软件开发工程师（可实习JAVA或Python）,郑州悠络客信息技术有限公司,郑州-高新区,4.5-6千/月,01-09
Python自动化测试工程师,上海易宝软件有限公司深圳分公司,成都-郫都区,0.7-1.4万/月,01-09
初中级数据开发工程师-python,北京新大陆时代教育科技有限公司,福州,1-1.5万/月,01-09
Python培训师,上海晔枫教育科技有限公司,上海-静安区,6-8千/月,01-09
大数据开发/python工程师,广州品宜贸易有限公司,广州-天河区,20-30万/年,01-09
Python,上海龙翊信息安全技术有限公司,上海-普陀区,2-3万/月,01-09
中级python开发工程师,南京国图信息产业有限公司,南京,1-1.5万/月,01-09
实习生(前端&Python&Java&ASP.NET),广州云岫信息科技有限公司,广州-天河区,3-5千/月,01-09
Python开发工程师 - 运营中心,网易集团,广州,2.5-3万/月,01-09
Python开发工程师,武汉光谷智能科技有限公司,武汉-武昌区,0.6-1万/月,01-09
python高级工程师,上海亚安信息技术有限公司,上海-虹口区,1.2-1.5万/月,01-09
Python开发工程师,杭州图华科技有限公司,杭州,0.9-1.5万/月,01-09
